{
  "schema_version": "reviews.v1",
  "generated_at": "2026-09-27T05:27:27.832Z",
  "timezone": "Europe/Minsk",
  "sources": {
    "google": {
      "place_id": "0x46dbcf13de883f57:0x7e6e3bff805d04d",
      "url": "https://www.google.com/maps/place/%D0%9B%D0%BE%D1%84%D1%82+%D0%A2%D1%80%D1%8D%D0%B2%D0%B5%D0%BB/@53.908511,27.5161381,17z/data=!4m8!3m7!1s0x46dbcf13de883f57:0x7e6e3bff805d04d!8m2!3d53.908511!4d27.518713!9m1!1b1!16s%2Fg%2F11h0hkh8j7?hl=ru"
    },
    "yandex": {
      "place_id": "160356850970",
      "url": "https://yandex.by/maps/org/loft_trevel/160356850970/reviews/?ll=27.518730%2C53.908686&z=17"
    }
  },
  "stats": {
    "total": 102,
    "google": 48,
    "yandex": 54,
    "with_photos": 30
  },
  "reviews": [
    {
      "source": "yandex",
      "source_place_id": "160356850970",
      "source_review_id": "fp_cb518672c1f4af52999e1d5df769b50d0e9bc45a110ec625adc353e3b0087cc4",
      "author": {
        "name": "Дарья А.",
        "avatar_url": null,
        "profile_url": "https://yandex.by/maps/user/2dxncc5zh511x8c04qxxvfnpdw"
      },
      "rating": 5,
      "text": "Благодарю менеджера Елену за подбор тура во Вьетнам. Ответила на все волнующие вопросы и помогла выбрать отличный вариант в пределах бюджета.…",
      "published_at_text": "31 августа",
      "published_at": "2026-08-31",
      "published_at_is_approximate": false,
      "date_precision": "exact",
      "first_seen_at": "2026-09-23T04:53:16.386Z",
      "last_seen_at": "2026-09-27T05:27:27.832Z",
      "source_url": "https://yandex.by/maps/org/loft_trevel/160356850970/reviews/?ll=27.518730%2C53.908686&z=17",
      "photos": [],
      "content_hash": "bbaa01e66a30e68cbedfe82593739efe4f44e59a6cb5af57f0c3313c0b43a1f8"
    },
    {
      "source": "yandex",
      "source_place_id": "160356850970",
      "source_review_id": "fp_55fe99b76e42c2bc2c147cf583f327affe259ce3f9adfb9c53bfc93f0aab2a4f",
      "author": {
        "name": "Сонька",
        "avatar_url": null,
        "profile_url": "https://yandex.by/maps/user/eq1n3u6veyfxnna44mmk0wnfdg"
      },
      "rating": 5,
      "text": "Огромное спасибо Loft Travel и в частности Елене за организацию отдыха. Елена помогала на каждом этапе, учитывала все пожелания и отвечала на все вопросы Обязательно обратимся ещё раз и будем рекомендовать друзьям!",
      "published_at_text": "30 августа",
      "published_at": "2026-08-30",
      "published_at_is_approximate": false,
      "date_precision": "exact",
      "first_seen_at": "2026-08-31T00:27:15.388Z",
      "last_seen_at": "2026-09-27T05:27:27.832Z",
      "source_url": "https://yandex.by/maps/org/loft_trevel/160356850970/reviews/?ll=27.518730%2C53.908686&z=17",
      "photos": [],
      "content_hash": "aa55d982ecd7fadf635148de308d57170b1d99b8f406868294baef420798f176"
    },
    {
      "source": "yandex",
      "source_place_id": "160356850970",
      "source_review_id": "fp_fcbff0115f1997223d0b6a71666f3305182cbf10e369af4e7986d364eed230cd",
      "author": {
        "name": "Виктория Брановец",
        "avatar_url": null,
        "profile_url": "https://yandex.by/maps/user/qqptx0zx05hgekfuu7jhdj9tdm"
      },
      "rating": 5,
      "text": "Хотим выразить огромную благодарность за отличную работу менеджера Виктории. Спасибо за внимательность, скурпулезность, ответственность, понимание и помощь в подборе тура и дальнейшем сопровождении!!!!",
      "published_at_text": "7 августа",
      "published_at": "2026-08-07",
      "published_at_is_approximate": false,
      "date_precision": "exact",
      "first_seen_at": "2026-08-15T16:59:30.205Z",
      "last_seen_at": "2026-09-27T05:27:27.832Z",
      "source_url": "https://yandex.by/maps/org/loft_trevel/160356850970/reviews/?ll=27.518730%2C53.908686&z=17",
      "photos": [],
      "content_hash": "76e6c8208498d89b4eea5579a8a9600c6acd0af2b02867335ed890ea9539d817"
    },
    {
      "source": "google",
      "source_place_id": "0x46dbcf13de883f57:0x7e6e3bff805d04d",
      "source_review_id": "Ci9DQUlRQUNvZENodHljRjlvT205SVpXSldkbWR6ZEdKcGFFMUJhVUZEV1MxR2FuYxAB",
      "author": {
        "name": "Лера Дворак",
        "avatar_url": "https://raw.githubusercontent.com/lofttravel/lofttravel_rewies/main/public/media/avatars/3e3afaefc876c97568313722.webp",
        "profile_url": "https://www.google.com/maps/contrib/106913448841167206107/reviews?hl=ru"
      },
      "rating": 5,
      "text": "Осталась довольна работой туроператора, все подробно рассказал и объяснил,помог с выбором места для отдыха с семьей Спасибо",
      "published_at_text": "2 месяца назад",
      "published_at": "2026-07-15",
      "published_at_is_approximate": true,
      "date_precision": "month",
      "first_seen_at": "2026-08-15T16:59:30.205Z",
      "last_seen_at": "2026-09-27T05:27:27.832Z",
      "source_url": "https://www.google.com/maps/place/%D0%9B%D0%BE%D1%84%D1%82+%D0%A2%D1%80%D1%8D%D0%B2%D0%B5%D0%BB/@53.908511,27.5161381,17z/data=!4m8!3m7!1s0x46dbcf13de883f57:0x7e6e3bff805d04d!8m2!3d53.908511!4d27.518713!9m1!1b1!16s%2Fg%2F11h0hkh8j7?hl=ru",
      "photos": [],
      "content_hash": "bd5101d5917c98e3ee2c01df85a80f4b586c7eaff151e45cf1ec674d812bed04"
    },
    {
      "source": "google",
      "source_place_id": "0x46dbcf13de883f57:0x7e6e3bff805d04d",
      "source_review_id": "Ci9DQUlRQUNvZENodHljRjlvT213NFl6TkdTMUJFUjAxYVRITkJXazlPZFc1T1dtYxAB",
      "author": {
        "name": "Елена",
        "avatar_url": "https://raw.githubusercontent.com/lofttravel/lofttravel_rewies/main/public/media/avatars/d80e9cdbeae5efbffadc4964.webp",
        "profile_url": "https://www.google.com/maps/contrib/110203429057187958465/reviews?hl=ru"
      },
      "rating": 5,
      "text": "Турагентств и турагентов много, а таких замечательный профессионалов очень мало! Второй раз с мужем бронируем тур именно здесь. Всегда подробно и грамотно проконсультируют, предложат лучшее и расскажут все как есть. Отдельное спасибо Елене …",
      "published_at_text": "3 месяца назад",
      "published_at": "2026-07-15",
      "published_at_is_approximate": true,
      "date_precision": "month",
      "first_seen_at": "2026-08-15T16:59:30.205Z",
      "last_seen_at": "2026-09-27T05:27:27.832Z",
      "source_url": "https://www.google.com/maps/place/%D0%9B%D0%BE%D1%84%D1%82+%D0%A2%D1%80%D1%8D%D0%B2%D0%B5%D0%BB/@53.908511,27.5161381,17z/data=!4m8!3m7!1s0x46dbcf13de883f57:0x7e6e3bff805d04d!8m2!3d53.908511!4d27.518713!9m1!1b1!16s%2Fg%2F11h0hkh8j7?hl=ru",
      "photos": [],
      "content_hash": "389755f5634e63b8ee732e3fd436c8a7dacb89bd366383f7681b76fc5c7dca84"
    },
    {
      "source": "google",
      "source_place_id": "0x46dbcf13de883f57:0x7e6e3bff805d04d",
      "source_review_id": "Ci9DQUlRQUNvZENodHljRjlvT214R1QxODBRMGd5WDB0MWEwbFJTM1YxUTFaMVEyYxAB",
      "author": {
        "name": "Анна С",
        "avatar_url": "https://raw.githubusercontent.com/lofttravel/lofttravel_rewies/main/public/media/avatars/8e10b8171fbea71af86ca21c.webp",
        "profile_url": "https://www.google.com/maps/contrib/105310313412461409971/reviews?hl=ru"
      },
      "rating": 5,
      "text": "Огромное спасибо Лофт Трэвел за отличный отдых! Всё было оформлено чётко и быстро, менеджер Виктория была на связи на протяжении всей поездки. Наша семья Ваша навеки!",
      "published_at_text": "3 месяца назад",
      "published_at": "2026-07-15",
      "published_at_is_approximate": true,
      "date_precision": "month",
      "first_seen_at": "2026-08-15T16:59:30.205Z",
      "last_seen_at": "2026-09-27T05:27:27.832Z",
      "source_url": "https://www.google.com/maps/place/%D0%9B%D0%BE%D1%84%D1%82+%D0%A2%D1%80%D1%8D%D0%B2%D0%B5%D0%BB/@53.908511,27.5161381,17z/data=!4m8!3m7!1s0x46dbcf13de883f57:0x7e6e3bff805d04d!8m2!3d53.908511!4d27.518713!9m1!1b1!16s%2Fg%2F11h0hkh8j7?hl=ru",
      "photos": [],
      "content_hash": "a5d77d70efef7416530145482e31e52115af34c837a21efd09d01046dffca88f"
    },
    {
      "source": "google",
      "source_place_id": "0x46dbcf13de883f57:0x7e6e3bff805d04d",
      "source_review_id": "Ci9DQUlRQUNvZENodHljRjlvT21sU1kwVkhZbXhVT0V4MWRtMVBkVEJRVW1kU2FsRRAB",
      "author": {
        "name": "Ольга Кульчик",
        "avatar_url": "https://raw.githubusercontent.com/lofttravel/lofttravel_rewies/main/public/media/avatars/6ce8f516d69e6d875dcdb706.webp",
        "profile_url": "https://www.google.com/maps/contrib/117764628071116737282/reviews?hl=ru"
      },
      "rating": 5,
      "text": "Подобрали страну и отель под наши запросы очень быстро, и на следующий день был заключён договор. Ждём с нетерпеи6 наш отдых с Вашей помощью!",
      "published_at_text": "3 месяца назад",
      "published_at": "2026-07-15",
      "published_at_is_approximate": true,
      "date_precision": "month",
      "first_seen_at": "2026-08-15T16:59:30.205Z",
      "last_seen_at": "2026-09-27T05:27:27.832Z",
      "source_url": "https://www.google.com/maps/place/%D0%9B%D0%BE%D1%84%D1%82+%D0%A2%D1%80%D1%8D%D0%B2%D0%B5%D0%BB/@53.908511,27.5161381,17z/data=!4m8!3m7!1s0x46dbcf13de883f57:0x7e6e3bff805d04d!8m2!3d53.908511!4d27.518713!9m1!1b1!16s%2Fg%2F11h0hkh8j7?hl=ru",
      "photos": [],
      "content_hash": "cc2de678a066076754a23c9da42d6d2a1662493f660714d22b120f26592a67a6"
    },
    {
      "source": "google",
      "source_place_id": "0x46dbcf13de883f57:0x7e6e3bff805d04d",
      "source_review_id": "Ci9DQUlRQUNvZENodHljRjlvT25CbVZrd3RiV3h0YUVWNVlWQndRVlpUWVZsb1VVRRAB",
      "author": {
        "name": "Ольга Саковец",
        "avatar_url": "https://raw.githubusercontent.com/lofttravel/lofttravel_rewies/main/public/media/avatars/80b4ebeee8549582c62f428c.webp",
        "profile_url": "https://www.google.com/maps/contrib/112412757960566599557/reviews?hl=ru"
      },
      "rating": 5,